[
  {
    "extraction_config_id": "EC-S1-FUELQTY-FACILITY-NAME",
    "field_id": "facility_name",
    "field_label": "Facility name",
    "description": "Name of the facility or site associated with the stationary fuel consumption record.",
    "canonical_type_id": "CT-S1-FUELQTY",
    "value_type": "string",
    "required_status": "core",
    "expected_units": [],
    "source_reference_required": true,
    "anchor_labels": ["Facility", "Facility Name", "Site", "Location", "Premises"],
    "value_patterns": [],
    "unit_patterns": [],
    "table_hints": ["account summary", "service details"],
    "sheet_hints": [],
    "validation_hints": ["Should identify a physical facility or site."],
    "extraction_methods": ["anchor_text", "key_value_pair", "llm_structured", "manual_entry"],
    "normalization": {
      "target_unit": null,
      "date_format": null,
      "number_format": null,
      "allowed_values": [],
      "unit_conversion_allowed": false,
      "trim_whitespace": true,
      "remove_thousands_separators": false
    },
    "regulatory_field_id": null,
    "notes": "Seed-only. Align field_id to regulatory/product schema in a later PR.",
    "population_status": "provisional",
    "version": "v0.1",
    "last_reviewed": null
  },
  {
    "extraction_config_id": "EC-S1-FUELQTY-SERVICE-ADDRESS",
    "field_id": "service_address",
    "field_label": "Service or account address",
    "description": "Service or account address shown on the utility/fuel bill.",
    "canonical_type_id": "CT-S1-FUELQTY",
    "value_type": "string",
    "required_status": "conditional",
    "expected_units": [],
    "source_reference_required": true,
    "anchor_labels": ["Service Address", "Service Location", "Account Address", "Billing Address"],
    "value_patterns": [],
    "unit_patterns": [],
    "table_hints": ["account summary"],
    "sheet_hints": [],
    "validation_hints": ["Prefer service address over billing address when both are present."],
    "extraction_methods": ["anchor_text", "key_value_pair", "llm_structured", "manual_entry"],
    "normalization": {
      "target_unit": null,
      "date_format": null,
      "number_format": null,
      "allowed_values": [],
      "unit_conversion_allowed": false,
      "trim_whitespace": true,
      "remove_thousands_separators": false
    },
    "regulatory_field_id": null,
    "notes": "Seed-only provisional configuration.",
    "population_status": "provisional",
    "version": "v0.1",
    "last_reviewed": null
  },
  {
    "extraction_config_id": "EC-S1-FUELQTY-FUEL-TYPE",
    "field_id": "fuel_type",
    "field_label": "Fuel type",
    "description": "Type of stationary fuel consumed (e.g., natural gas, fuel oil, propane).",
    "canonical_type_id": "CT-S1-FUELQTY",
    "value_type": "string",
    "required_status": "core",
    "expected_units": [],
    "source_reference_required": true,
    "anchor_labels": ["Fuel", "Fuel Type", "Commodity", "Service Type"],
    "value_patterns": [],
    "unit_patterns": [],
    "table_hints": ["usage table", "billing summary"],
    "sheet_hints": [],
    "validation_hints": ["Must map to a recognized stationary fuel."],
    "extraction_methods": ["anchor_text", "key_value_pair", "llm_structured", "manual_entry"],
    "normalization": {
      "target_unit": null,
      "date_format": null,
      "number_format": null,
      "allowed_values": ["natural_gas", "fuel_oil", "propane", "diesel", "coal", "biomass"],
      "unit_conversion_allowed": false,
      "trim_whitespace": true,
      "remove_thousands_separators": false
    },
    "regulatory_field_id": null,
    "notes": "Seed-only provisional configuration.",
    "population_status": "provisional",
    "version": "v0.1",
    "last_reviewed": null
  },
  {
    "extraction_config_id": "EC-S1-FUELQTY-ACTIVITY-QUANTITY",
    "field_id": "activity_quantity",
    "field_label": "Activity quantity",
    "description": "Quantity of fuel consumed during the service period.",
    "canonical_type_id": "CT-S1-FUELQTY",
    "value_type": "quantity",
    "required_status": "core",
    "expected_units": ["MMBtu", "therm", "Dth", "kWh", "MWh", "GJ", "scf", "ccf", "Mcf", "MMcf", "m3", "gal", "L", "bbl", "lb", "kg", "short_ton", "metric_ton"],
    "source_reference_required": true,
    "anchor_labels": ["Total Usage", "Gas Used", "Usage", "Quantity", "Consumption"],
    "value_patterns": ["\\d[\\d,]*(?:\\.\\d+)?"],
    "unit_patterns": ["MMBtu", "therms?", "ccf", "gallons?", "liters?"],
    "table_hints": ["usage table", "billing summary"],
    "sheet_hints": [],
    "validation_hints": ["Must be positive and tied to the service period."],
    "extraction_methods": ["anchor_text", "regex", "table_lookup", "key_value_pair", "llm_structured"],
    "normalization": {
      "target_unit": "MMBtu",
      "date_format": null,
      "number_format": "decimal",
      "allowed_values": [],
      "unit_conversion_allowed": true,
      "trim_whitespace": true,
      "remove_thousands_separators": true
    },
    "regulatory_field_id": null,
    "notes": "Seed-only provisional configuration. EXT-001: energy units normalize to MMBtu; gas volume, liquid volume and mass keep their canonical unit (HHV conversion is a calculation step, S1-STC-020). Units: backend/app/domain/fuel_units.py.",
    "population_status": "provisional",
    "version": "v0.1",
    "last_reviewed": null
  },
  {
    "extraction_config_id": "EC-S1-FUELQTY-ACTIVITY-UNIT",
    "field_id": "activity_unit",
    "field_label": "Activity unit",
    "description": "Unit of measure for the reported fuel activity quantity.",
    "canonical_type_id": "CT-S1-FUELQTY",
    "value_type": "string",
    "required_status": "core",
    "expected_units": ["MMBtu", "therm", "Dth", "kWh", "MWh", "GJ", "scf", "ccf", "Mcf", "MMcf", "m3", "gal", "L", "bbl", "lb", "kg", "short_ton", "metric_ton"],
    "source_reference_required": true,
    "anchor_labels": ["Unit", "Units", "UOM"],
    "value_patterns": [],
    "unit_patterns": ["MMBtu", "therms?", "ccf", "gallons?", "liters?"],
    "table_hints": ["usage table"],
    "sheet_hints": [],
    "validation_hints": ["Unit must be consistent with the activity quantity."],
    "extraction_methods": ["anchor_text", "regex", "key_value_pair", "llm_structured"],
    "normalization": {
      "target_unit": "MMBtu",
      "date_format": null,
      "number_format": null,
      "allowed_values": ["MMBtu", "therm", "Dth", "kWh", "MWh", "GJ", "scf", "ccf", "Mcf", "MMcf", "m3", "gal", "L", "bbl", "lb", "kg", "short_ton", "metric_ton"],
      "unit_conversion_allowed": false,
      "trim_whitespace": true,
      "remove_thousands_separators": false
    },
    "regulatory_field_id": null,
    "notes": "Seed-only provisional configuration. EXT-001: allowed values are the canonical units in backend/app/domain/fuel_units.py (to confirm against the Scope 1 schema).",
    "population_status": "provisional",
    "version": "v0.1",
    "last_reviewed": null
  },
  {
    "extraction_config_id": "EC-S1-FUELQTY-SERVICE-PERIOD-START",
    "field_id": "service_period_start",
    "field_label": "Service period start",
    "description": "Start date of the bill service or usage period.",
    "canonical_type_id": "CT-S1-FUELQTY",
    "value_type": "date",
    "required_status": "core",
    "expected_units": [],
    "source_reference_required": true,
    "anchor_labels": ["Service Period", "Billing Period", "From", "Period Start", "Read Date"],
    "value_patterns": ["\\d{4}-\\d{2}-\\d{2}", "\\d{1,2}/\\d{1,2}/\\d{2,4}"],
    "unit_patterns": [],
    "table_hints": ["billing summary"],
    "sheet_hints": [],
    "validation_hints": ["Start date must be on or before the end date."],
    "extraction_methods": ["anchor_text", "regex", "key_value_pair", "llm_structured"],
    "normalization": {
      "target_unit": null,
      "date_format": "YYYY-MM-DD",
      "number_format": null,
      "allowed_values": [],
      "unit_conversion_allowed": false,
      "trim_whitespace": true,
      "remove_thousands_separators": false
    },
    "regulatory_field_id": null,
    "notes": "Seed-only provisional configuration.",
    "population_status": "provisional",
    "version": "v0.1",
    "last_reviewed": null
  },
  {
    "extraction_config_id": "EC-S1-FUELQTY-SERVICE-PERIOD-END",
    "field_id": "service_period_end",
    "field_label": "Service period end",
    "description": "End date of the bill service or usage period.",
    "canonical_type_id": "CT-S1-FUELQTY",
    "value_type": "date",
    "required_status": "core",
    "expected_units": [],
    "source_reference_required": true,
    "anchor_labels": ["Service Period", "Billing Period", "To", "Period End", "Read Date"],
    "value_patterns": ["\\d{4}-\\d{2}-\\d{2}", "\\d{1,2}/\\d{1,2}/\\d{2,4}"],
    "unit_patterns": [],
    "table_hints": ["billing summary"],
    "sheet_hints": [],
    "validation_hints": ["End date must be on or after the start date."],
    "extraction_methods": ["anchor_text", "regex", "key_value_pair", "llm_structured"],
    "normalization": {
      "target_unit": null,
      "date_format": "YYYY-MM-DD",
      "number_format": null,
      "allowed_values": [],
      "unit_conversion_allowed": false,
      "trim_whitespace": true,
      "remove_thousands_separators": false
    },
    "regulatory_field_id": null,
    "notes": "Seed-only provisional configuration.",
    "population_status": "provisional",
    "version": "v0.1",
    "last_reviewed": null
  },
  {
    "extraction_config_id": "EC-S1-FUELQTY-SUPPLIER-NAME",
    "field_id": "supplier_name",
    "field_label": "Supplier or utility name",
    "description": "Name of the utility or fuel supplier issuing the bill.",
    "canonical_type_id": "CT-S1-FUELQTY",
    "value_type": "string",
    "required_status": "conditional",
    "expected_units": [],
    "source_reference_required": true,
    "anchor_labels": ["Utility", "Supplier", "Provider", "Company", "Issued By"],
    "value_patterns": [],
    "unit_patterns": [],